<?xml version="1.0" encoding="UTF-8" standalone="no" ?>
<Assembly xmlns:xsi="http://www.w3.org/2001/XMLSchema-instance" xsi:noNamespaceSchemaLocation="AssemblyInterface.xsd">

  <CADComponent ComponentID="100000052" Name="Engine_Transmission" Type="ASSEMBLY">
    <CADComponent ComponentID="100000362" Name="CAT_C9" Type="PART">
      <Constraint>
        <Pair FeatureAlignmentType="ALIGN" FeatureGeometryType="SURFACE" FeatureInterfaceType="CAD_DATUM">
          <ConstraintFeature ComponentID="100000362" FeatureName="FRONT" FeatureOrientationType="SIDE_A"/>
          <ConstraintFeature ComponentID="100000052" FeatureName="ASM_FRONT" FeatureOrientationType="SIDE_A"/>
        </Pair>
        <Pair FeatureAlignmentType="ALIGN" FeatureGeometryType="SURFACE" FeatureInterfaceType="CAD_DATUM">
          <ConstraintFeature ComponentID="100000362" FeatureName="TOP" FeatureOrientationType="SIDE_A"/>
          <ConstraintFeature ComponentID="100000052" FeatureName="ASM_TOP" FeatureOrientationType="SIDE_A"/>
        </Pair>
        <Pair FeatureAlignmentType="ALIGN" FeatureGeometryType="SURFACE" FeatureInterfaceType="CAD_DATUM">
          <ConstraintFeature ComponentID="100000362" FeatureName="RIGHT" FeatureOrientationType="SIDE_A"/>
          <ConstraintFeature ComponentID="100000052" FeatureName="ASM_RIGHT" FeatureOrientationType="SIDE_A"/>
        </Pair>
      </Constraint>
    </CADComponent>
    <CADComponent ComponentID="100000487" Name="CAT_CX31" Type="PART">
      <Constraint>
        <Pair FeatureAlignmentType="ALIGN" FeatureGeometryType="SURFACE" FeatureInterfaceType="CAD_DATUM">
          <ConstraintFeature ComponentID="100000362" FeatureName="FLYWHEEL_HOUSING_MNT_SURF" FeatureOrientationType="SIDE_A"/>
          <ConstraintFeature ComponentID="100000487" FeatureName="FLYWHEEL_HOUSING_MNT_SURF" FeatureOrientationType="SIDE_B"/>
        </Pair>
        <Pair FeatureAlignmentType="ALIGN" FeatureGeometryType="AXIS" FeatureInterfaceType="CAD_DATUM">
          <ConstraintFeature ComponentID="100000362" FeatureName="FLYWHEEL_HOUSING_BTM_BOLT_AXIS" FeatureOrientationType="NONE"/>
          <ConstraintFeature ComponentID="100000487" FeatureName="FLYWHEEL_HOUSING_BTM_BOLT_AXIS" FeatureOrientationType="NONE"/>
        </Pair>
        <Pair FeatureAlignmentType="ALIGN" FeatureGeometryType="AXIS" FeatureInterfaceType="CAD_DATUM">
          <ConstraintFeature ComponentID="100000362" FeatureName="DRIVE_AXIS" FeatureOrientationType="NONE"/>
          <ConstraintFeature ComponentID="100000487" FeatureName="DRIVE_AXIS" FeatureOrientationType="NONE"/>
        </Pair>
      </Constraint>
    </CADComponent>
  </CADComponent>

  <Properties>
    <Units Value="value1"/>
  </Properties>

</Assembly>
